{
  "fixtureSchema": "urn:uuid:da99d351-12ed-42b8-8ddd-9fc761e638f0",
  "protocolRelease": "ghostbridge/e1.r0-draft.1",
  "classification": "boundary",
  "cases": [
    { "id": "FX-TENANT-LENGTH-128", "kind": "value", "targetSchema": "urn:uuid:3358b7cb-f988-4bf6-b812-970a3f3dcb13", "value": "AAAAAAAAAAAAAAAAAAAAAAAAAAAAAAAAAAAAAAAAAAAAAAAAAAAAAAAAAAAAAAAAAAAAAAAAAAAAAAAAAAAAAAAAAAAAAAAAAAAAAAAAAAAAAAAAAAAAAAAAAAAAAAAA", "structuralExpected": "pass", "semanticExpected": "pass", "semanticCheck": "tenant-id" },
    { "id": "FX-TENANT-LENGTH-129", "kind": "value", "targetSchema": "urn:uuid:3358b7cb-f988-4bf6-b812-970a3f3dcb13", "value": "AAAAAAAAAAAAAAAAAAAAAAAAAAAAAAAAAAAAAAAAAAAAAAAAAAAAAAAAAAAAAAAAAAAAAAAAAAAAAAAAAAAAAAAAAAAAAAAAAAAAAAAAAAAAAAAAAAAAAAAAAAAAAAAAA", "structuralExpected": "fail", "semanticExpected": "not-applicable", "semanticCheck": "none" },
    { "id": "FX-CORRELATION-ONE-OCTET", "kind": "value", "targetSchema": "urn:uuid:fcb537b3-67fc-4621-b25d-adf3fbbe81b5", "value": "AA", "structuralExpected": "pass", "semanticExpected": "pass", "semanticCheck": "canonical-base64url" },
    { "id": "FX-CORRELATION-64-OCTETS", "kind": "value", "targetSchema": "urn:uuid:fcb537b3-67fc-4621-b25d-adf3fbbe81b5", "value": "AAAAAAAAAAAAAAAAAAAAAAAAAAAAAAAAAAAAAAAAAAAAAAAAAAAAAAAAAAAAAAAAAAAAAAAAAAAAAAAAAAAAAA", "structuralExpected": "pass", "semanticExpected": "pass", "semanticCheck": "canonical-base64url" },
    { "id": "FX-IDEMPOTENCY-KEY-128-OCTETS", "kind": "value", "targetSchema": "urn:uuid:3868e676-6b8a-4692-b7d4-4e47ff5e88f4", "value": "AAAAAAAAAAAAAAAAAAAAAAAAAAAAAAAAAAAAAAAAAAAAAAAAAAAAAAAAAAAAAAAAAAAAAAAAAAAAAAAAAAAAAAAAAAAAAAAAAAAAAAAAAAAAAAAAAAAAAAAAAAAAAAAAAAAAAAAAAAAAAAAAAAAAAAAAAAAAAAAAAAAAAAAAAAA", "structuralExpected": "pass", "semanticExpected": "pass", "semanticCheck": "canonical-base64url" },
    { "id": "FX-TIMESTAMP-YEAR-0001", "kind": "value", "targetSchema": "urn:uuid:691c8a94-3fe6-4a48-89d3-412600e1e2a4", "value": "0001-01-01T00:00:00.000Z", "structuralExpected": "pass", "semanticExpected": "pass", "semanticCheck": "canonical-timestamp" },
    { "id": "FX-TIMESTAMP-YEAR-9999", "kind": "value", "targetSchema": "urn:uuid:691c8a94-3fe6-4a48-89d3-412600e1e2a4", "value": "9999-12-31T23:59:59.999Z", "structuralExpected": "pass", "semanticExpected": "pass", "semanticCheck": "canonical-timestamp" },
    { "id": "FX-TRUST-SEQUENCE-MIN", "kind": "value", "targetSchema": "urn:uuid:d2b355cb-7e39-423a-9a5c-7cbc9926ffa7", "value": 1, "structuralExpected": "pass", "semanticExpected": "not-applicable", "semanticCheck": "none" },
    { "id": "FX-TRUST-SEQUENCE-MAX", "kind": "value", "targetSchema": "urn:uuid:d2b355cb-7e39-423a-9a5c-7cbc9926ffa7", "value": 9007199254740991, "structuralExpected": "pass", "semanticExpected": "not-applicable", "semanticCheck": "none" },
    { "id": "FX-RETRY-AFTER-MIN", "kind": "value", "targetSchema": "urn:uuid:be60b3f6-6a58-4946-8aad-860edaf89495", "value": 0, "structuralExpected": "pass", "semanticExpected": "not-applicable", "semanticCheck": "none" },
    { "id": "FX-RETRY-AFTER-MAX", "kind": "value", "targetSchema": "urn:uuid:be60b3f6-6a58-4946-8aad-860edaf89495", "value": 3600, "structuralExpected": "pass", "semanticExpected": "not-applicable", "semanticCheck": "none" },
    { "id": "FX-REGISTRY-TOKEN-LENGTH-128", "kind": "value", "targetSchema": "urn:uuid:d213d7c9-15da-41f2-b51b-286944581a74", "value": "aaaaaaaaaaaaaaaaaaaaaaaaaaaaaaaaaaaaaaaaaaaaaaaaaaaaaaaaaaaaaaaaaaaaaaaaaaaaaaaaaaaaaaaaaaaaaaaaaaaaaaaaaaaaaaaaaaaaaaaaaaaaaaaa", "structuralExpected": "pass", "semanticExpected": "not-applicable", "semanticCheck": "none" },
    { "id": "FX-REGISTRY-TOKEN-LENGTH-129", "kind": "value", "targetSchema": "urn:uuid:d213d7c9-15da-41f2-b51b-286944581a74", "value": "aaaaaaaaaaaaaaaaaaaaaaaaaaaaaaaaaaaaaaaaaaaaaaaaaaaaaaaaaaaaaaaaaaaaaaaaaaaaaaaaaaaaaaaaaaaaaaaaaaaaaaaaaaaaaaaaaaaaaaaaaaaaaaaaa", "structuralExpected": "fail", "semanticExpected": "not-applicable", "semanticCheck": "none" },
    { "id": "FX-REGISTRY-REVISION-MAX", "kind": "value", "targetSchema": "urn:uuid:735bbcfb-bdd0-4c80-8c40-351ce5e5c93e", "value": 2147483647, "structuralExpected": "pass", "semanticExpected": "not-applicable", "semanticCheck": "none" },
    { "id": "FX-EXTENSION-TOTAL-255", "kind": "value", "targetSchema": "urn:uuid:ac23dacd-18f3-4920-aa45-15aa695f1234", "value": "aaaaaaaaaaaaaaaaaaaaaaaaaaaaaaaaaaaaaaaaaaaaaaaaaaaaaaaaaaaaaaa.aaaaaaaaaaaaaaaaaaaaaaaaaaaaaaaaaaaaaaaaaaaaaaaaaaaaaaaaaaaaaaa.aaaaaaaaaaaaaaaaaaaaaaaaaaaaaaaaaaaaaaaaaaaaaaaaaaaaaaaaaaaaaaa.aaaaaaaaaaaaaaaaaaaaaaaaaaaaaaaaaaaaaaaaaaaaaaaaaaaaaaaaaaaaa/a", "structuralExpected": "pass", "semanticExpected": "pass", "semanticCheck": "extension-identity" },
    { "id": "FX-EXTENSION-TOTAL-256", "kind": "value", "targetSchema": "urn:uuid:ac23dacd-18f3-4920-aa45-15aa695f1234", "value": "aaaaaaaaaaaaaaaaaaaaaaaaaaaaaaaaaaaaaaaaaaaaaaaaaaaaaaaaaaaaaaa.aaaaaaaaaaaaaaaaaaaaaaaaaaaaaaaaaaaaaaaaaaaaaaaaaaaaaaaaaaaaaaa.aaaaaaaaaaaaaaaaaaaaaaaaaaaaaaaaaaaaaaaaaaaaaaaaaaaaaaaaaaaaaaa.aaaaaaaaaaaaaaaaaaaaaaaaaaaaaaaaaaaaaaaaaaaaaaaaaaaaaaaaaaaaa/ab", "structuralExpected": "fail", "semanticExpected": "not-applicable", "semanticCheck": "none" },
    { "id": "FX-ARTIFACT-BYTE-LENGTH-MAX", "kind": "value", "targetSchema": "urn:uuid:16534fa9-8aa1-4324-b6b9-a2a1043682f3", "value": { "algorithm": "sha-256", "value": "AAAAAAAAAAAAAAAAAAAAAAAAAAAAAAAAAAAAAAAAAAA", "byteLength": 9007199254740991 }, "structuralExpected": "pass", "semanticExpected": "pass", "semanticCheck": "artifact-byte-integrity" }
  ]
}
